ArticleId,Title,Body,CreateDate,StartDate,EndDate,UserName
1,How Dough Cats are taking over the World,"There is a lot of hype around the new creatures known as doughcats in riot's top tier autobattle simulator, TFT.",2025-03-15 14:30:45,2025-03-15 14:30:45,2025-03-29 14:30:45,a@a.a
2,The Rise of AI Companions,"Artificial Intelligence is transforming how we interact with technology, from chatbots to personal assistants.",2025-03-16 10:15:30,2025-03-16 10:15:30,2025-03-30 10:15:30,b@b.b
3,Exploring the Deep Ocean,Scientists are uncovering new marine species and mysteries hidden in the unexplored depths of the ocean.,2025-03-17 09:00:00,2025-03-17 09:00:00,2025-03-31 09:00:00,c@c.c
4,Mars Colonization: The Next Step,Space agencies and private companies are racing to establish a human presence on Mars within the next decade.,2025-03-18 12:45:20,2025-03-18 12:45:20,2025-04-1 12:45:20,d@d.d
5,Quantum Computing Breakthroughs,"Researchers have made significant advancements in quantum computing, paving the way for solving complex problems.",2025-03-19 16:20:10,2025-04-2 16:20:10,2025-03-25 16:20:10,e@e.e
